{
  "$schema": "../../packages/evals/schema/makerbench-task.schema.json",
  "id": "t1-flanged-bushing",
  "tier": "T1",
  "title": "Flanged bushing for an 8 mm rod",
  "prompt": "Flanged bushing for an 8 mm rod, to be turned from Delrin: 8.1 mm bore, 12 mm outside diameter, 15 mm long overall including an 18 mm diameter, 2 mm thick flange at one end.",
  "process": "cnc",
  "tags": ["bushing", "round", "revolve"],
  "requires": ["ir/0", "feature/revolve"],
  "reference": "t1-flanged-bushing.cad.ts",
  "hidden_tests": [
    {
      "id": "valid",
      "description": "Evaluates cleanly and every body is a valid closed solid",
      "check": "valid",
      "eq": true
    },
    {
      "id": "one_body",
      "description": "Exactly one solid body (one printable part)",
      "check": "body_count",
      "eq": 1
    },
    {
      "id": "size",
      "description": "18 mm flange diameter, 15 mm long, ±0.1 mm",
      "check": "bbox_sorted",
      "approx": [15, 18, 18],
      "abs": 0.1
    },
    {
      "id": "round_faces",
      "description": "Three cylindrical faces: bore, body and flange rim",
      "check": "face_count",
      "type": "cylinder",
      "eq": 3
    },
    {
      "id": "flat_faces",
      "description": "Three flat faces: both ends and the flange shoulder",
      "check": "face_count",
      "type": "plane",
      "eq": 3
    },
    {
      "id": "volume",
      "description": "Volume ≈ 1206.3 mm³ ±1%",
      "check": "volume",
      "approx": 1206.25,
      "rel": 0.01
    }
  ]
}
