{
  "$schema": "../../packages/evals/schema/makerbench-task.schema.json",
  "id": "t1-m3-hex-standoff",
  "tier": "T1",
  "title": "M3 hex standoff",
  "prompt": "Hex standoff for M3: 5.5 mm across the flats, 12 mm tall, with a 2.5 mm hole through the middle so I can tap an M3 thread into it.",
  "process": "fdm",
  "tags": ["standoff", "fastener", "hex", "electronics"],
  "requires": ["ir/0"],
  "reference": "t1-m3-hex-standoff.cad.ts",
  "hidden_tests": [
    {
      "id": "valid",
      "description": "Evaluates cleanly and every body is a valid closed solid",
      "check": "valid",
      "eq": true
    },
    {
      "id": "one_body",
      "description": "Exactly one solid body (one printable part)",
      "check": "body_count",
      "eq": 1
    },
    {
      "id": "size",
      "description": "5.5 mm across flats, 6.35 mm across corners, 12 mm tall, ±0.05 mm",
      "check": "bbox_sorted",
      "approx": [5.5, 6.351, 12],
      "abs": 0.05
    },
    {
      "id": "hex_faces",
      "description": "Eight flat faces: six hex sides plus the two ends",
      "check": "face_count",
      "type": "plane",
      "eq": 8
    },
    {
      "id": "bore",
      "description": "One cylindrical bore through the middle",
      "check": "face_count",
      "type": "cylinder",
      "eq": 1
    },
    {
      "id": "volume",
      "description": "Volume (hexagon 26.20 mm² − Ø2.5 hole)·12 ≈ 255.5 mm³ ±1%",
      "check": "volume",
      "approx": 255.46,
      "rel": 0.01
    }
  ],
  "notes": "2.5 mm is the M3 tap drill. Across corners = 5.5 / cos 30° = 6.351 mm."
}
