{
  "$schema": "../../packages/evals/schema/makerbench-task.schema.json",
  "id": "t1-gridfinity-cell",
  "tier": "T1",
  "title": "Simplified Gridfinity baseplate cell",
  "prompt": "A simplified single-cell Gridfinity-style baseplate: a 42 x 42 mm frame with 4 mm corner radius on the outside, a 36 x 36 mm opening with 1 mm corner radius, 5 mm tall. No chamfered profile, straight walls are fine.",
  "process": "fdm",
  "tags": ["gridfinity", "storage", "rounded-rectangle"],
  "requires": ["ir/0"],
  "reference": "t1-gridfinity-cell.cad.ts",
  "hidden_tests": [
    {
      "id": "valid",
      "description": "Evaluates cleanly and every body is a valid closed solid",
      "check": "valid",
      "eq": true
    },
    {
      "id": "one_body",
      "description": "Exactly one solid body (one printable part)",
      "check": "body_count",
      "eq": 1
    },
    {
      "id": "size",
      "description": "42 x 42 mm, 5 mm tall, ±0.1 mm",
      "check": "bbox_sorted",
      "approx": [5, 42, 42],
      "abs": 0.1
    },
    {
      "id": "opening",
      "description": "One opening through the middle",
      "check": "inner_loops",
      "eq": 1
    },
    {
      "id": "rounded_corners",
      "description": "Eight rounded corners: four outside (R4) and four inside (R1)",
      "check": "face_count",
      "type": "cylinder",
      "eq": 8
    },
    {
      "id": "volume",
      "description": "Volume (42² R4 − 36² R1)·5 ≈ 2275.6 mm³ ±1%",
      "check": "volume",
      "approx": 2275.62,
      "rel": 0.01
    }
  ],
  "notes": "Real Gridfinity baseplates have a stepped chamfer profile (needs sweeps/booleans); this is the IR v0 simplification."
}
