{
  "$schema": "../../packages/evals/schema/makerbench-task.schema.json",
  "id": "t1-bearing-housing",
  "tier": "T1",
  "title": "608 bearing housing",
  "prompt": "Housing ring for a 608 bearing (22 mm OD, 7 mm wide): 30 mm outside diameter, 8 mm tall, with a 22 mm pocket 7 mm deep from the top and a 1 mm lip at the bottom that leaves a 19 mm hole.",
  "process": "fdm",
  "tags": ["bearing", "608-bearing", "housing", "revolve"],
  "requires": ["ir/0", "feature/revolve"],
  "reference": "t1-bearing-housing.cad.ts",
  "hidden_tests": [
    {
      "id": "valid",
      "description": "Evaluates cleanly and every body is a valid closed solid",
      "check": "valid",
      "eq": true
    },
    {
      "id": "one_body",
      "description": "Exactly one solid body (one printable part)",
      "check": "body_count",
      "eq": 1
    },
    {
      "id": "size",
      "description": "30 mm diameter, 8 mm tall, ±0.1 mm",
      "check": "bbox_sorted",
      "approx": [8, 30, 30],
      "abs": 0.1
    },
    {
      "id": "round_faces",
      "description": "Three cylindrical faces: outside, 22 mm pocket and 19 mm lip bore",
      "check": "face_count",
      "type": "cylinder",
      "eq": 3
    },
    {
      "id": "flat_faces",
      "description": "Three flat faces: bottom, top and the lip the bearing sits on",
      "check": "face_count",
      "type": "plane",
      "eq": 3
    },
    {
      "id": "volume",
      "description": "Volume 862.75π ≈ 2710.4 mm³ ±1%",
      "check": "volume",
      "approx": 2710.41,
      "rel": 0.01
    }
  ]
}
