{
  "$schema": "../../packages/evals/schema/makerbench-task.schema.json",
  "id": "t1-sg90-mount",
  "tier": "T1",
  "title": "SG90 micro servo mount",
  "prompt": "Mounting plate for an SG90 micro servo: 40 x 20 x 3 mm with a 23 x 12.5 mm rectangular cutout in the middle for the servo body, and two 2.2 mm holes for the servo's mounting screws, 27.5 mm apart along the long axis (centred).",
  "process": "fdm",
  "tags": ["mounting-plate", "servo", "electronics"],
  "requires": ["ir/0"],
  "reference": "t1-sg90-mount.cad.ts",
  "hidden_tests": [
    {
      "id": "valid",
      "description": "Evaluates cleanly and every body is a valid closed solid",
      "check": "valid",
      "eq": true
    },
    {
      "id": "one_body",
      "description": "Exactly one solid body (one printable part)",
      "check": "body_count",
      "eq": 1
    },
    {
      "id": "size",
      "description": "40 x 20 mm, 3 mm thick, ±0.1 mm",
      "check": "bbox_sorted",
      "approx": [3, 20, 40],
      "abs": 0.1
    },
    {
      "id": "cutouts",
      "description": "Three cut-outs: the servo opening and two screw holes",
      "check": "inner_loops",
      "eq": 3
    },
    {
      "id": "screw_holes",
      "description": "Two 2.2 mm screw holes (2.1–2.4 mm) 27.5 mm apart",
      "check": "hole_pattern",
      "diameter": [2.1, 2.4],
      "points": [[0, 0], [27.5, 0]]
    },
    {
      "id": "flat_faces",
      "description": "Ten flat faces: four outside, four cut-out walls, top and bottom",
      "check": "face_count",
      "type": "plane",
      "eq": 10
    },
    {
      "id": "volume",
      "description": "Volume (40·20 − 23·12.5 − 2·Ø2.2)·3 ≈ 1514.7 mm³ ±1%",
      "check": "volume",
      "approx": 1514.69,
      "rel": 0.01
    }
  ],
  "notes": "Dimensions as given by the user (SG90 body ~22.5 x 12 mm, tab holes ~27.5 mm apart)."
}
