{
  "$schema": "../../packages/evals/schema/makerbench-task.schema.json",
  "id": "t1-rpi4-plate",
  "tier": "T1",
  "title": "Raspberry Pi 4 mounting plate",
  "prompt": "Mounting plate for a Raspberry Pi 4 so I can screw it into a project box. Same footprint as the board (85 x 56 mm), 3 mm thick, with holes for M2.5 screws (2.7 mm) on the Pi's 58 x 49 mm pattern. The holes sit 3.5 mm in from the edges at the end away from the USB ports, like on the real board.",
  "process": "fdm",
  "tags": ["mounting-plate", "raspberry-pi", "electronics", "hole-pattern"],
  "requires": ["ir/0"],
  "reference": "t1-rpi4-plate.cad.ts",
  "hidden_tests": [
    {
      "id": "valid",
      "description": "Evaluates cleanly and every body is a valid closed solid",
      "check": "valid",
      "eq": true
    },
    {
      "id": "one_body",
      "description": "Exactly one solid body (one printable part)",
      "check": "body_count",
      "eq": 1
    },
    {
      "id": "size",
      "description": "85 x 56 mm, 3 mm thick, ±0.1 mm",
      "check": "bbox_sorted",
      "approx": [3, 56, 85],
      "abs": 0.1
    },
    {
      "id": "pi_pattern",
      "description": "Four 2.7 mm (M2.5 clearance) holes on the Pi's 58 x 49 mm rectangle",
      "check": "hole_pattern",
      "diameter": [2.6, 2.9],
      "points": [[0, 0], [58, 0], [58, 49], [0, 49]]
    },
    {
      "id": "edge_inset",
      "description": "The holes sit 3.5 mm in from the edges at one end, like on the board: offsets 3.5/3.5 at that end and 3.5/23.5 at the other",
      "check": "hole_positions",
      "relative_to": "edges",
      "diameter": [2.6, 2.9],
      "points": [[3.5, 3.5], [3.5, 3.5], [3.5, 23.5], [3.5, 23.5]],
      "tol": 0.1
    },
    {
      "id": "only_holes",
      "description": "Exactly four holes, nothing else cut out",
      "check": "inner_loops",
      "eq": 4
    },
    {
      "id": "volume",
      "description": "Volume (85·56 − 4·Ø2.7)·3 ≈ 14211 mm³ ±0.5%",
      "check": "volume",
      "approx": 14211.29,
      "rel": 0.005
    }
  ],
  "notes": "Raspberry Pi 4 mechanical drawing: 85 x 56 board, M2.5 holes 58 x 49 apart, 3.5 mm from the edges. edge_inset catches a pattern centred along the plate (offsets 13.5/3.5), which hole_pattern and the bounding box cannot."
}
